question,answer
Karaciğerdeki kistler alınır mı?,Çoğu iyi huyludur ve takip edilir; çok büyük veya şikayet yapıyorsa cerrahi düşünülebilir.
Karaciğer kisti olursa ne yapılır?,Çoğu iyi huyludur ve takip edilir; çok büyük veya şikayet yapıyorsa cerrahi düşünülebilir.
Karaciğer nodülü nedir,Karaciğerdeki kitlesel oluşumlara verilen genel addır; iyi veya kötü huylu olabilir.
Karaciğer nodülünün anlamı nedir?,Karaciğerdeki kitlesel oluşumlara verilen genel addır; iyi veya kötü huylu olabilir.
Karaciğerde nodül çıkması ne demek?,Karaciğerdeki kitlesel oluşumlara verilen genel addır; iyi veya kötü huylu olabilir.
Karaciğerde nodül varsa ne olur?,Karaciğerdeki kitlesel oluşumlara verilen genel addır; iyi veya kötü huylu olabilir.
Karaciğer hastalıklarında mide bulantısı neden olur,"Safra akışı bozulabilir, toksin birikimi mide bulantısına yol açabilir."
Karaciğer hastalığında mide bulantısının sebebi nedir?,"Safra akışı bozulabilir, toksin birikimi mide bulantısına yol açabilir."
Karaciğer hastalığında neden mide bulanır?,"Safra akışı bozulabilir, toksin birikimi mide bulantısına yol açabilir."
Karaciğer hastalığında mide neden bulanır?,"Safra akışı bozulabilir, toksin birikimi mide bulantısına yol açabilir."
Karaciğer hastalıklarında kaşıntı neden olur,Safra tuzlarının birikmesi ciltte kaşıntıya sebep olur.
Karaciğer hastalığında kaşıntının nedeni nedir?,Safra tuzlarının birikmesi ciltte kaşıntıya sebep olur.
Karaciğer hastalığında neden kaşıntı olur?,Safra tuzlarının birikmesi ciltte kaşıntıya sebep olur.
Karaciğer hastalığında cilt neden kaşınır?,Safra tuzlarının birikmesi ciltte kaşıntıya sebep olur.
Karaciğer hastalarında kabızlık görülür mü,"Evet, özellikle sirozda bağırsak hareketleri yavaşlayabilir."
Karaciğer hastalığında kabızlık olur mu?,"Evet, özellikle sirozda bağırsak hareketleri yavaşlayabilir."
Karaciğer hastalığı kabızlık yapar mı?,"Evet, özellikle sirozda bağırsak hareketleri yavaşlayabilir."
Karaciğer hastalığında neden kabızlık olur?,"Evet, özellikle sirozda bağırsak hareketleri yavaşlayabilir."
Karaciğer hastalıklarında kilo almak doğru mu,İdeal kilonun korunması önemlidir; aşırı kilo almak zararlıdır.
Karaciğer hastalığında kilo almak zararlı mı?,İdeal kilonun korunması önemlidir; aşırı kilo almak zararlıdır.
Karaciğer hastalığı olanlar kilo almalı mı?,İdeal kilonun korunması önemlidir; aşırı kilo almak zararlıdır.
Karaciğer hastalığında kilo almak faydalı mı?,İdeal kilonun korunması önemlidir; aşırı kilo almak zararlıdır.
Karaciğer sağlığı için ne kadar su içilmeli,"Yeterli sıvı alımı karaciğer fonksiyonlarını destekler; günde 2-2,5 litre önerilir."
Karaciğer için günlük su ihtiyacı ne kadardır?,"Yeterli sıvı alımı karaciğer fonksiyonlarını destekler; günde 2-2,5 litre önerilir."
Karaciğer hastalığında su tüketimi önemli mi?,"Yeterli sıvı alımı karaciğer fonksiyonlarını destekler; günde 2-2,5 litre önerilir."
Karaciğer sağlığı için günde kaç litre su içilmeli?,"Yeterli sıvı alımı karaciğer fonksiyonlarını destekler; günde 2-2,5 litre önerilir."
Karaciğer hastaları hangi ilaçları kullanamaz,Parasetamol gibi bazı ağrı kesiciler yüksek dozda zararlı olabilir; her ilaç doktora danışılarak alınmalıdır.
Karaciğer hastalığında hangi ilaçlar sakıncalıdır?,Parasetamol gibi bazı ağrı kesiciler yüksek dozda zararlı olabilir; her ilaç doktora danışılarak alınmalıdır.
Karaciğer hastalığı olanlar hangi ilaçlardan kaçınmalı?,Parasetamol gibi bazı ağrı kesiciler yüksek dozda zararlı olabilir; her ilaç doktora danışılarak alınmalıdır.
Karaciğer hastalığında ilaç kullanımı nasıl olmalı?,Parasetamol gibi bazı ağrı kesiciler yüksek dozda zararlı olabilir; her ilaç doktora danışılarak alınmalıdır.
Karaciğer hastalıklarında sigara içmek zararlı mı,"Evet, sigara karaciğer hasarını artırabilir, kanser riskini yükseltir."
Karaciğer hastalığında sigara kullanımı riskli mi?,"Evet, sigara karaciğer hasarını artırabilir, kanser riskini yükseltir."
Sigara karaciğer hastalığını kötüleştirir mi?,"Evet, sigara karaciğer hasarını artırabilir, kanser riskini yükseltir."
Karaciğer hastalığı olanlar sigara içebilir mi?,"Evet, sigara karaciğer hasarını artırabilir, kanser riskini yükseltir."
Karaciğer hastalarında psikolojik destek gerekir mi,Kronik hastalıklar psikolojik yük oluşturur; destek almak önemlidir.
Karaciğer hastalığında psikolojik destek önemli mi?,Kronik hastalıklar psikolojik yük oluşturur; destek almak önemlidir.
Karaciğer hastalığı olanlar psikolojik yardım almalı mı?,Kronik hastalıklar psikolojik yük oluşturur; destek almak önemlidir.
Karaciğer hastalığında ruhsal destek gerekir mi?,Kronik hastalıklar psikolojik yük oluşturur; destek almak önemlidir.
Karaciğer hastalarında spor yapılabilir mi,Hafif-orta düzey egzersiz faydalıdır; doktor önerisine göre planlanmalıdır.
Karaciğer hastalığı olanlar spor yapabilir mi?,Hafif-orta düzey egzersiz faydalıdır; doktor önerisine göre planlanmalıdır.
Karaciğer hastalığında egzersiz yapılır mı?,Hafif-orta düzey egzersiz faydalıdır; doktor önerisine göre planlanmalıdır.
Karaciğer hastalığı olanlar hangi sporu yapabilir?,Hafif-orta düzey egzersiz faydalıdır; doktor önerisine göre planlanmalıdır.
Karaciğer hastalıkları çocuklarda da görülür mü,"Evet, doğumsal metabolik hastalıklar, viral hepatitler çocuklarda da görülebilir."
Çocuklarda karaciğer hastalığı olur mu?,"Evet, doğumsal metabolik hastalıklar, viral hepatitler çocuklarda da görülebilir."
Çocuklarda karaciğer rahatsızlığı görülür mü?,"Evet, doğumsal metabolik hastalıklar, viral hepatitler çocuklarda da görülebilir."
Çocuklarda karaciğer hastalığı gelişir mi?,"Evet, doğumsal metabolik hastalıklar, viral hepatitler çocuklarda da görülebilir."
Karaciğer ile ilgili: Çocuklarda hepatit A nasıl önlenir,Hijyen kurallarına uymak ve aşı yaptırmak korunmada etkilidir.
Karaciğer ile ilgili: Çocuklarda hepatit A'dan korunmak için ne yapılmalı?,Hijyen kurallarına uymak ve aşı yaptırmak korunmada etkilidir.
Karaciğer ile ilgili: Çocuklarda hepatit A'ya karşı nasıl önlem alınır?,Hijyen kurallarına uymak ve aşı yaptırmak korunmada etkilidir.
Karaciğer ile ilgili: Çocuklarda hepatit A bulaşmasın diye ne yapılır?,Hijyen kurallarına uymak ve aşı yaptırmak korunmada etkilidir.
Karaciğer ile ilgili: Çocuklarda hepatit B nasıl önlenir,Doğumda aşı yapılması en etkili korumadır.
Karaciğer ile ilgili: Çocuklarda hepatit B'den korunmanın yolu nedir?,Doğumda aşı yapılması en etkili korumadır.
Karaciğer ile ilgili: Çocuklarda hepatit B'ye karşı ne yapılmalı?,Doğumda aşı yapılması en etkili korumadır.
Karaciğer ile ilgili: Çocuklarda hepatit B bulaşmasın diye ne yapılır?,Doğumda aşı yapılması en etkili korumadır.
Karaciğer büyümesi nedir,"Hepatomegali olarak bilinir; iltihap, yağlanma veya kalp yetmezliği gibi birçok sebepten kaynaklanabilir."
Karaciğer ile ilgili: Hepatomegali ne anlama gelir?,"Hepatomegali olarak bilinir; iltihap, yağlanma veya kalp yetmezliği gibi birçok sebepten kaynaklanabilir."
Karaciğerin büyümesi ne demek?,"Hepatomegali olarak bilinir; iltihap, yağlanma veya kalp yetmezliği gibi birçok sebepten kaynaklanabilir."
Karaciğer neden büyür?,"Hepatomegali olarak bilinir; iltihap, yağlanma veya kalp yetmezliği gibi birçok sebepten kaynaklanabilir."
Karaciğer küçülmesi ne anlama gelir,Genelde ileri sirozda görülür; karaciğer dokusu kaybına işaret eder.
Karaciğerin küçülmesi ne demek?,Genelde ileri sirozda görülür; karaciğer dokusu kaybına işaret eder.
Karaciğer neden küçülür?,Genelde ileri sirozda görülür; karaciğer dokusu kaybına işaret eder.
Karaciğer dokusu neden azalır?,Genelde ileri sirozda görülür; karaciğer dokusu kaybına işaret eder.
Karaciğer hastalıklarında ömür beklentisi nedir,"Hastalığın türüne, evresine ve tedaviye bağlı olarak değişir."
Karaciğer hastalığında yaşam süresi neye bağlıdır?,"Hastalığın türüne, evresine ve tedaviye bağlı olarak değişir."
Karaciğer hastalığı olanların ömrü ne kadar olur?,"Hastalığın türüne, evresine ve tedaviye bağlı olarak değişir."
Karaciğer hastalığında ömür neye göre değişir?,"Hastalığın türüne, evresine ve tedaviye bağlı olarak değişir."
Karaciğer dostu besinler nelerdir,"Yeşil sebzeler, tam tahıllar, balık, ceviz gibi sağlıklı yağlar önerilir."
Karaciğer için faydalı yiyecekler hangileridir?,"Yeşil sebzeler, tam tahıllar, balık, ceviz gibi sağlıklı yağlar önerilir."
Karaciğer sağlığına iyi gelen besinler nelerdir?,"Yeşil sebzeler, tam tahıllar, balık, ceviz gibi sağlıklı yağlar önerilir."
Karaciğer dostu gıdalar neler?,"Yeşil sebzeler, tam tahıllar, balık, ceviz gibi sağlıklı yağlar önerilir."
Karaciğer tahlilleri normal ama şikayet varsa ne olur,"Diğer organlar, bağırsaklar veya safra yolları da incelenmelidir."
Karaciğer testleri normal çıkarsa ama şikayet devam ederse ne yapılır?,"Diğer organlar, bağırsaklar veya safra yolları da incelenmelidir."
Karaciğer değerleri normal ama sorun varsa ne olur?,"Diğer organlar, bağırsaklar veya safra yolları da incelenmelidir."
Karaciğer tahlilleri temiz ama şikayet varsa neye bakılır?,"Diğer organlar, bağırsaklar veya safra yolları da incelenmelidir."
Karaciğer hastalıklarında doktor takibi ne sıklıkta olmalı,Kronik hastalıklarda 3-6 ayda bir kontroller önerilir.
Karaciğer hastalığında kontrol aralığı ne olmalı?,Kronik hastalıklarda 3-6 ayda bir kontroller önerilir.
Karaciğer hastalığı olanlar ne kadar sıklıkla doktora gitmeli?,Kronik hastalıklarda 3-6 ayda bir kontroller önerilir.
Karaciğer hastalığında takip süresi ne kadardır?,Kronik hastalıklarda 3-6 ayda bir kontroller önerilir.
Karaciğer hastaları oruç tutabilir mi,Doktor kontrolü olmadan oruç önerilmez; duruma göre karar verilir.
Karaciğer hastalığı olanlar oruç tutabilir mi?,Doktor kontrolü olmadan oruç önerilmez; duruma göre karar verilir.
Karaciğer hastalığında oruç sakıncalı mı?,Doktor kontrolü olmadan oruç önerilmez; duruma göre karar verilir.
Karaciğer hastalığı olanlar oruç tutarsa ne olur?,Doktor kontrolü olmadan oruç önerilmez; duruma göre karar verilir.
Karaciğer nedir,"Karaciğer, karnın sağ üst kısmında yer alan, vücudun en büyük organlarından biridir. Besinleri işler, zararlı maddeleri temizler ve safra üretir."
Karaciğerin tanımı nedir?,"Karaciğer, karnın sağ üst kısmında yer alan, vücudun en büyük organlarından biridir. Besinleri işler, zararlı maddeleri temizler ve safra üretir."
Karaciğer ne işe yarar?,"Karaciğer, karnın sağ üst kısmında yer alan, vücudun en büyük organlarından biridir. Besinleri işler, zararlı maddeleri temizler ve safra üretir."
Karaciğer vücutta ne yapar?,"Karaciğer, karnın sağ üst kısmında yer alan, vücudun en büyük organlarından biridir. Besinleri işler, zararlı maddeleri temizler ve safra üretir."
Karaciğerin görevi nedir,"Karaciğer, besinlerin sindirilmesi, toksinlerin atılması, enerji depolanması ve kanın pıhtılaşmasına yardımcı olan proteinlerin üretilmesi gibi önemli işlevleri yürütür."
Karaciğerin işlevleri nelerdir?,"Karaciğer, besinlerin sindirilmesi, toksinlerin atılması, enerji depolanması ve kanın pıhtılaşmasına yardımcı olan proteinlerin üretilmesi gibi önemli işlevleri yürütür."
Karaciğer hangi görevleri üstlenir?,"Karaciğer, besinlerin sindirilmesi, toksinlerin atılması, enerji depolanması ve kanın pıhtılaşmasına yardımcı olan proteinlerin üretilmesi gibi önemli işlevleri yürütür."
Karaciğer vücutta ne gibi işlevlere sahiptir?,"Karaciğer, besinlerin sindirilmesi, toksinlerin atılması, enerji depolanması ve kanın pıhtılaşmasına yardımcı olan proteinlerin üretilmesi gibi önemli işlevleri yürütür."
Karaciğer ile ilgili: Hepatit nedir,"Hepatit, karaciğer iltihaplanmasıdır. Genellikle virüslerden kaynaklanır ama alkol kullanımı veya bağışıklık sistemi bozuklukları da sebep olabilir."
Karaciğer ile ilgili: Hepatit hastalığı ne demektir?,"Hepatit, karaciğer iltihaplanmasıdır. Genellikle virüslerden kaynaklanır ama alkol kullanımı veya bağışıklık sistemi bozuklukları da sebep olabilir."
Karaciğer iltihabı nedir?,"Hepatit, karaciğer iltihaplanmasıdır. Genellikle virüslerden kaynaklanır ama alkol kullanımı veya bağışıklık sistemi bozuklukları da sebep olabilir."
Karaciğer ile ilgili: Hepatit nasıl bir hastalıktır?,"Hepatit, karaciğer iltihaplanmasıdır. Genellikle virüslerden kaynaklanır ama alkol kullanımı veya bağışıklık sistemi bozuklukları da sebep olabilir."
Karaciğer ile ilgili: Siroz nedir,"Siroz, karaciğer dokusunun hasar görüp skar dokusuna dönüşmesiyle karaciğerin normal işlevini kaybetmesidir."
Karaciğer ile ilgili: Siroz hastalığı ne demektir?,"Siroz, karaciğer dokusunun hasar görüp skar dokusuna dönüşmesiyle karaciğerin normal işlevini kaybetmesidir."
Karaciğerde siroz ne anlama gelir?,"Siroz, karaciğer dokusunun hasar görüp skar dokusuna dönüşmesiyle karaciğerin normal işlevini kaybetmesidir."
Karaciğer ile ilgili: Siroz olunca ne olur?,"Siroz, karaciğer dokusunun hasar görüp skar dokusuna dönüşmesiyle karaciğerin normal işlevini kaybetmesidir."
Yağlı karaciğer hastalığı nedir,Karaciğer hücrelerinde aşırı yağ birikmesiyle oluşur. Alkol kullanımına bağlı veya bağımsız olabilir.
Yağlı karaciğer hastalığı ne demek?,Karaciğer hücrelerinde aşırı yağ birikmesiyle oluşur. Alkol kullanımına bağlı veya bağımsız olabilir.
Karaciğerde yağlanma nedir?,Karaciğer hücrelerinde aşırı yağ birikmesiyle oluşur. Alkol kullanımına bağlı veya bağımsız olabilir.
Yağlı karaciğer ne anlama gelir?,Karaciğer hücrelerinde aşırı yağ birikmesiyle oluşur. Alkol kullanımına bağlı veya bağımsız olabilir.
Alkolik karaciğer hastalığı nedir,Uzun süreli ve aşırı alkol kullanımı sonucu karaciğerin zarar görmesi durumudur.
Alkole bağlı karaciğer hastalığı nedir?,Uzun süreli ve aşırı alkol kullanımı sonucu karaciğerin zarar görmesi durumudur.
Alkolik karaciğer hastalığı ne demek?,Uzun süreli ve aşırı alkol kullanımı sonucu karaciğerin zarar görmesi durumudur.
Alkol kullanımı karaciğeri nasıl bozar?,Uzun süreli ve aşırı alkol kullanımı sonucu karaciğerin zarar görmesi durumudur.
Karaciğer ile ilgili: NAFLD nedir,"Non-alkolik yağlı karaciğer hastalığı, alkol kullanımı olmadan karaciğerde yağ birikmesiyle oluşur."
Non-alkolik yağlı karaciğer hastalığı ne demek?,"Non-alkolik yağlı karaciğer hastalığı, alkol kullanımı olmadan karaciğerde yağ birikmesiyle oluşur."
Karaciğer ile ilgili: NAFLD hastalığı nedir?,"Non-alkolik yağlı karaciğer hastalığı, alkol kullanımı olmadan karaciğerde yağ birikmesiyle oluşur."
Alkolsüz yağlı karaciğer hastalığı nedir?,"Non-alkolik yağlı karaciğer hastalığı, alkol kullanımı olmadan karaciğerde yağ birikmesiyle oluşur."
Karaciğer yetmezliği nedir,Karaciğerin görevlerini yerine getirememesi durumudur. Ani (akut) veya uzun vadeli (kronik) olabilir.
Karaciğer yetmezliği ne anlama gelir?,Karaciğerin görevlerini yerine getirememesi durumudur. Ani (akut) veya uzun vadeli (kronik) olabilir.
Karaciğer çalışmazsa ne olur?,Karaciğerin görevlerini yerine getirememesi durumudur. Ani (akut) veya uzun vadeli (kronik) olabilir.
Karaciğer yetmezliği olursa ne olur?,Karaciğerin görevlerini yerine getirememesi durumudur. Ani (akut) veya uzun vadeli (kronik) olabilir.
Karaciğer kanseri nedir,Karaciğer hücrelerinin kontrolsüz şekilde çoğalarak tümör oluşturmasıdır.
Karaciğer kanseri ne demek?,Karaciğer hücrelerinin kontrolsüz şekilde çoğalarak tümör oluşturmasıdır.
Karaciğerde kanser oluşursa ne olur?,Karaciğer hücrelerinin kontrolsüz şekilde çoğalarak tümör oluşturmasıdır.
Karaciğer kanseri nasıl bir hastalıktır?,Karaciğer hücrelerinin kontrolsüz şekilde çoğalarak tümör oluşturmasıdır.
Karaciğer ile ilgili: Hepatocellular carcinoma (HCC) nedir,Karaciğer kanserinin en yaygın türüdür ve genellikle siroz zemininde gelişir.
Karaciğer ile ilgili: Hepatoselüler karsinom nedir?,Karaciğer kanserinin en yaygın türüdür ve genellikle siroz zemininde gelişir.
Karaciğer ile ilgili: HCC hastalığı ne demek?,Karaciğer kanserinin en yaygın türüdür ve genellikle siroz zemininde gelişir.
"Karaciğer ile ilgili: HCC nedir, ne anlama gelir?",Karaciğer kanserinin en yaygın türüdür ve genellikle siroz zemininde gelişir.
Karaciğer hastalıklarının belirtileri nelerdir,"Yorgunluk, sarılık, karın şişliği, kilo kaybı, iştahsızlık ve koyu renkli idrar görülebilir."
Karaciğer hastalığında hangi belirtiler olur?,"Yorgunluk, sarılık, karın şişliği, kilo kaybı, iştahsızlık ve koyu renkli idrar görülebilir."
Karaciğer hastalığı nasıl anlaşılır?,"Yorgunluk, sarılık, karın şişliği, kilo kaybı, iştahsızlık ve koyu renkli idrar görülebilir."
Karaciğer hastalığı olanlarda ne gibi şikayetler olur?,"Yorgunluk, sarılık, karın şişliği, kilo kaybı, iştahsızlık ve koyu renkli idrar görülebilir."
Karaciğer ile ilgili: Sarılık nedir,"Karaciğer hastalıklarında sık görülen, cilt ve gözlerin sararması durumudur. Bilirubin birikimi sonucu oluşur."
Karaciğer ile ilgili: Sarılık hastalığı ne demek?,"Karaciğer hastalıklarında sık görülen, cilt ve gözlerin sararması durumudur. Bilirubin birikimi sonucu oluşur."
Karaciğer ile ilgili: Ciltte sararma neden olur?,"Karaciğer hastalıklarında sık görülen, cilt ve gözlerin sararması durumudur. Bilirubin birikimi sonucu oluşur."
Karaciğer ile ilgili: Sarılık olunca ne olur?,"Karaciğer hastalıklarında sık görülen, cilt ve gözlerin sararması durumudur. Bilirubin birikimi sonucu oluşur."
Karaciğer hastalıkları nasıl teşhis edilir,"Kan testleri, ultrason, MR, biyopsi ve diğer görüntüleme yöntemleriyle tanı konulur."
Karaciğer hastalığı tanısı nasıl konur?,"Kan testleri, ultrason, MR, biyopsi ve diğer görüntüleme yöntemleriyle tanı konulur."
Karaciğer hastalığı için hangi tetkikler yapılır?,"Kan testleri, ultrason, MR, biyopsi ve diğer görüntüleme yöntemleriyle tanı konulur."
Karaciğer hastalığı nasıl anlaşılır?,"Kan testleri, ultrason, MR, biyopsi ve diğer görüntüleme yöntemleriyle tanı konulur."
Karaciğer biyopsisi nedir,Karaciğerden küçük bir doku örneği alınarak laboratuvarda incelenmesidir.
Karaciğer biyopsisi ne demek?,Karaciğerden küçük bir doku örneği alınarak laboratuvarda incelenmesidir.
Karaciğerden biyopsi alınması ne anlama gelir?,Karaciğerden küçük bir doku örneği alınarak laboratuvarda incelenmesidir.
Karaciğer biyopsisi nasıl yapılır?,Karaciğerden küçük bir doku örneği alınarak laboratuvarda incelenmesidir.
Karaciğer hastalıkları nasıl tedavi edilir,"Nedene bağlıdır. İlaç tedavisi, yaşam tarzı değişiklikleri, alkolün bırakılması veya ileri vakalarda karaciğer nakli gerekebilir."
Karaciğer hastalığı tedavisinde hangi yöntemler kullanılır?,"Nedene bağlıdır. İlaç tedavisi, yaşam tarzı değişiklikleri, alkolün bırakılması veya ileri vakalarda karaciğer nakli gerekebilir."
Karaciğer hastalığı nasıl iyileşir?,"Nedene bağlıdır. İlaç tedavisi, yaşam tarzı değişiklikleri, alkolün bırakılması veya ileri vakalarda karaciğer nakli gerekebilir."
Karaciğer hastalığı olanlar nasıl tedavi edilir?,"Nedene bağlıdır. İlaç tedavisi, yaşam tarzı değişiklikleri, alkolün bırakılması veya ileri vakalarda karaciğer nakli gerekebilir."
Karaciğer nakli nedir,Hasar gören karaciğerin bir donörden alınan sağlıklı karaciğerle değiştirilmesidir.
Karaciğer nakli ne demek?,Hasar gören karaciğerin bir donörden alınan sağlıklı karaciğerle değiştirilmesidir.
Karaciğer nakli nasıl yapılır?,Hasar gören karaciğerin bir donörden alınan sağlıklı karaciğerle değiştirilmesidir.
Karaciğer nakli olursa ne olur?,Hasar gören karaciğerin bir donörden alınan sağlıklı karaciğerle değiştirilmesidir.
Karaciğer ile ilgili: Hepatit B nasıl bulaşır,"Kan yolu, cinsel temas veya anneden bebeğe geçişle bulaşabilir."
Karaciğer ile ilgili: Hepatit B virüsü hangi yollarla yayılır?,"Kan yolu, cinsel temas veya anneden bebeğe geçişle bulaşabilir."
Karaciğer ile ilgili: Hepatit B enfeksiyonu nasıl geçer?,"Kan yolu, cinsel temas veya anneden bebeğe geçişle bulaşabilir."
Karaciğer ile ilgili: Hepatit B başkasına nasıl bulaşır?,"Kan yolu, cinsel temas veya anneden bebeğe geçişle bulaşabilir."
Karaciğer ile ilgili: Hepatit C nasıl bulaşır,En yaygın bulaş yolu kan temasıdır. Enjekte ilaç kullanımı yaygın bir risktir.
Karaciğer ile ilgili: Hepatit C virüsü hangi yolla bulaşır?,En yaygın bulaş yolu kan temasıdır. Enjekte ilaç kullanımı yaygın bir risktir.
Karaciğer ile ilgili: Hepatit C enfeksiyonu nasıl geçer?,En yaygın bulaş yolu kan temasıdır. Enjekte ilaç kullanımı yaygın bir risktir.
Karaciğer ile ilgili: Hepatit C başkasına nasıl bulaşır?,En yaygın bulaş yolu kan temasıdır. Enjekte ilaç kullanımı yaygın bir risktir.
Karaciğer ile ilgili: Hepatit A nasıl bulaşır,Genellikle kirli su veya yiyeceklerle ağız yoluyla bulaşır.
Karaciğer ile ilgili: Hepatit A virüsü hangi yolla yayılır?,Genellikle kirli su veya yiyeceklerle ağız yoluyla bulaşır.
Karaciğer ile ilgili: Hepatit A enfeksiyonu nasıl geçer?,Genellikle kirli su veya yiyeceklerle ağız yoluyla bulaşır.
Karaciğer ile ilgili: Hepatit A başkasına nasıl bulaşır?,Genellikle kirli su veya yiyeceklerle ağız yoluyla bulaşır.
Karaciğer ile ilgili: Hepatit B aşısı var mı,"Evet, Hepatit B enfeksiyonuna karşı etkili bir aşı vardır."
Karaciğer ile ilgili: Hepatit B için aşı mevcut mu?,"Evet, Hepatit B enfeksiyonuna karşı etkili bir aşı vardır."
Karaciğer ile ilgili: Hepatit B'ye karşı aşı var mı?,"Evet, Hepatit B enfeksiyonuna karşı etkili bir aşı vardır."
Karaciğer ile ilgili: Hepatit B aşısı bulunuyor mu?,"Evet, Hepatit B enfeksiyonuna karşı etkili bir aşı vardır."
Karaciğer ile ilgili: Hepatit C aşısı var mı,"Hayır, şu anda Hepatit C için onaylı bir aşı yoktur."
Karaciğer ile ilgili: Hepatit C için aşı mevcut mu?,"Hayır, şu anda Hepatit C için onaylı bir aşı yoktur."
Karaciğer ile ilgili: Hepatit C'ye karşı aşı var mı?,"Hayır, şu anda Hepatit C için onaylı bir aşı yoktur."
Karaciğer ile ilgili: Hepatit C aşısı bulunuyor mu?,"Hayır, şu anda Hepatit C için onaylı bir aşı yoktur."
Karaciğer sağlığı için nasıl beslenmeli,"Düşük yağlı, dengeli beslenme, alkol ve işlenmiş gıdalardan kaçınma önerilir."
Karaciğer sağlığı için beslenme önerileri nelerdir?,"Düşük yağlı, dengeli beslenme, alkol ve işlenmiş gıdalardan kaçınma önerilir."
Karaciğer için nasıl bir diyet uygulanmalı?,"Düşük yağlı, dengeli beslenme, alkol ve işlenmiş gıdalardan kaçınma önerilir."
Karaciğer sağlığı için ne yemeli?,"Düşük yağlı, dengeli beslenme, alkol ve işlenmiş gıdalardan kaçınma önerilir."
Karaciğer hastalıkları önlenebilir mi,"Alkol tüketimini sınırlamak, sağlıklı kiloda kalmak, hijyene dikkat etmek ve aşılanmak önleyici adımlardır."
Karaciğer hastalığı nasıl önlenir?,"Alkol tüketimini sınırlamak, sağlıklı kiloda kalmak, hijyene dikkat etmek ve aşılanmak önleyici adımlardır."
Karaciğer hastalığına yakalanmamak için ne yapılmalı?,"Alkol tüketimini sınırlamak, sağlıklı kiloda kalmak, hijyene dikkat etmek ve aşılanmak önleyici adımlardır."
Karaciğer hastalığı riskini azaltmak için ne yapılır?,"Alkol tüketimini sınırlamak, sağlıklı kiloda kalmak, hijyene dikkat etmek ve aşılanmak önleyici adımlardır."
Karaciğer hastalarında alkol tamamen bırakılmalı mı,"Evet, çoğu durumda alkol karaciğer hasarını artırdığı için tamamen bırakılmalıdır."
Karaciğer hastalığında alkol bırakılmalı mı?,"Evet, çoğu durumda alkol karaciğer hasarını artırdığı için tamamen bırakılmalıdır."
Karaciğer hastalığı olanlar alkol içebilir mi?,"Evet, çoğu durumda alkol karaciğer hasarını artırdığı için tamamen bırakılmalıdır."
Karaciğer hastalığında alkol zararlı mı?,"Evet, çoğu durumda alkol karaciğer hasarını artırdığı için tamamen bırakılmalıdır."
Karaciğer ile ilgili: Siroz geri döner mi,"İleri düzeyde siroz geri döndürülemez, ancak erken dönemde ilerlemesi durdurulabilir."
Karaciğer ile ilgili: Siroz hastalığı tamamen iyileşir mi?,"İleri düzeyde siroz geri döndürülemez, ancak erken dönemde ilerlemesi durdurulabilir."
Karaciğer ile ilgili: Sirozda iyileşme olur mu?,"İleri düzeyde siroz geri döndürülemez, ancak erken dönemde ilerlemesi durdurulabilir."
Karaciğer ile ilgili: Siroz ilerlemesi durdurulabilir mi?,"İleri düzeyde siroz geri döndürülemez, ancak erken dönemde ilerlemesi durdurulabilir."
